{"$id":"prufyx.io/synthetic-snapshot-factory/migration-provenance/v4","$schema":"https://json-schema.org/draft/2020-12/schema","additionalProperties":false,"properties":{"addedFiles":{"items":{"additionalProperties":false,"properties":{"path":{"pattern":"^[A-Za-z0-9_./-]+$","type":"string"},"v3Digest":{"pattern":"^sha256:[0-9a-f]{64}$","type":"string"}},"required":["path","v3Digest"],"type":"object"},"minItems":1,"type":"array","uniqueItems":true},"chain":{"additionalProperties":false,"properties":{"fromCorpus":{"const":"community-v3-context-corpus"},"previous":{"const":"testdata/synthetic-cluster-scenarios/v2/migration-provenance.json"},"previousDigest":{"pattern":"^sha256:[0-9a-f]{64}$","type":"string"},"status":{"const":"IMMUTABLE_PREDECESSOR_BOUND"},"toCorpus":{"const":"community-v3-context-corpus-v2"}},"required":["previous","previousDigest","fromCorpus","toCorpus","status"],"type":"object"},"fileMappings":{"items":{"additionalProperties":false,"properties":{"path":{"pattern":"^[A-Za-z0-9_./-]+$","type":"string"},"v2Digest":{"pattern":"^sha256:[0-9a-f]{64}$","type":"string"},"v2Path":{"pattern":"^[A-Za-z0-9_./-]+$","type":"string"},"v3Digest":{"pattern":"^sha256:[0-9a-f]{64}$","type":"string"},"v3Path":{"pattern":"^[A-Za-z0-9_./-]+$","type":"string"}},"required":["path","v2Digest","v3Path","v3Digest"],"type":"object"},"maxItems":50,"minItems":50,"type":"array"},"from":{"const":{"corpusId":"community-v3-context-corpus-v2","sourceRevision":"synthetic-snapshot-factory-v2"}},"kind":{"const":"SyntheticSnapshotCorpusMigrationProvenance"},"schema":{"const":"prufyx.io/synthetic-snapshot-factory/migration-provenance/v4"},"semanticPreservation":{"additionalProperties":false,"properties":{"authority":{"const":"CANDIDATE_ONLY_NO_RELEASE_AUTHORITY"},"evaluatorCount":{"const":16},"packageReasonClassAdded":{"const":"PACKAGE_TAKEDOWN_NOT_ASSESSED"},"preflightCount":{"const":2},"scenarioCount":{"const":18}},"required":["scenarioCount","evaluatorCount","preflightCount","packageReasonClassAdded","authority"],"type":"object"},"sourceTree":{"additionalProperties":false,"properties":{"algorithm":{"const":"sha256(concat(relativePath + NUL + fileSha256 + LF), sorted paths; excludes __pycache__ and migration-provenance.json)"},"fileCount":{"const":50},"postDigest":{"pattern":"^sha256:[0-9a-f]{64}$","type":"string"},"preDigest":{"pattern":"^sha256:[0-9a-f]{64}$","type":"string"}},"required":["algorithm","fileCount","preDigest","postDigest"],"type":"object"},"to":{"const":{"corpusId":"community-v4-context-corpus-v4","sourceRevision":"synthetic-snapshot-factory-v4"}}},"required":["schema","kind","from","to","sourceTree","fileMappings","addedFiles","semanticPreservation","chain"],"type":"object"}
