{"addedFiles":[{"path":"tests/strict-ajv.mjs","v3Digest":"sha256:499f50594de5c0316735f0679de005939a31e91bc71c7ef6a52de51b929c7f70"}],"chain":{"fromCorpus":"community-v3-context-corpus","previous":"testdata/synthetic-cluster-scenarios/v2/migration-provenance.json","previousDigest":"sha256:031c8e350acd3a3c291f3e7fd5b3fd7b32821100acb3dbc2a6ff4b305f7aef2a","status":"IMMUTABLE_PREDECESSOR_BOUND","toCorpus":"community-v3-context-corpus-v2"},"fileMappings":[{"path":"README.md","v2Digest":"sha256:122cc1e02c22d31fc994b14fc39bf92905e2bf47f0ba25bfd5f6b1e6071af3dc","v3Digest":"sha256:be9c0083a0d5425b0d60867d5b26f34ed19f2df618de14b032360720b9f551af","v3Path":"README.md"},{"path":"corpus-index.json","v2Digest":"sha256:df884a8dc19ac04ad4efc46d6cc533a0b917ec69fc4e70039189fb471e9d2045","v3Digest":"sha256:9da63bd5ff2d9f8bf5fc6670ae1642ab9d2ea1e9d193068631d17d34738acf78","v3Path":"corpus-index.json"},{"path":"go.mod","v2Digest":"sha256:f02e7353afdc61004b8f107e05fce1ba479820fa45cb3087d334fdf523838431","v3Digest":"sha256:cd807a7f368749d347a0b35f2776232ce0bbed9fdf0d9c69c0edf41d5a7e1799","v3Path":"go.mod"},{"path":"mutations/syn-tampered-source-binding.json","v2Digest":"sha256:26ac7fa58c865bfe1183eb4ee6beb467c475d80b698611a9d545d3322efed4cc","v3Digest":"sha256:917a6b0f66b7fd51523cdd812c8b308ec805a981b5d4f74cb651036cf5d8e716","v3Path":"mutations/syn-v4-tampered-source-binding.json"},{"path":"oracles/syn-argo-cd-minor-to-latest.json","v2Digest":"sha256:d73f0b1caf0e189a4fbae3bc26e6bc50bf3a19561e26994c04209336fb2d810d","v3Digest":"sha256:60e016897e070183c6fda3e81af974a73ecccff5bc95b637492e461aab4d41d5","v3Path":"oracles/syn-v4-argo-cd-minor-to-latest.json"},{"path":"oracles/syn-argo-cd-patch-to-latest.json","v2Digest":"sha256:0d369feabaf183a756b636ca60be5a329a6e899068d7c4dff6dd82be90bd46bf","v3Digest":"sha256:1d9b3f8ebf413522e6cd2b7f817a5af58e472de59f791cf47ffcba06f94062c6","v3Path":"oracles/syn-v4-argo-cd-patch-to-latest.json"},{"path":"oracles/syn-argo-workflows-minor-to-latest.json","v2Digest":"sha256:4dcb9ffa90d16819e59268c9c8c60b39287caab948ee2c03c95c2cb423728b20","v3Digest":"sha256:b20cfa1f76c1c22fd6216af7f712991fa8ba15295d3e2c22a1d53a7c911a9fdc","v3Path":"oracles/syn-v4-argo-workflows-minor-to-latest.json"},{"path":"oracles/syn-cert-manager-minor-to-latest.json","v2Digest":"sha256:c45f193fb065c3ab9401f43936f12c9b3b528fb25c27aae65ee7004554a59244","v3Digest":"sha256:66205517dfe8c35c5e99240a2a05e09f1a605a471fde4a5152d17801d485550c","v3Path":"oracles/syn-v4-cert-manager-minor-to-latest.json"},{"path":"oracles/syn-cert-manager-patch-to-latest.json","v2Digest":"sha256:9e506f8391ba7282ea519aefb3b593ec9783d42ceaba49051e612b215bd3bf1d","v3Digest":"sha256:498c0799d4fa2c34ce16aa1e377a39209cd99887d42c05f1dcf30fcfa04e14d3","v3Path":"oracles/syn-v4-cert-manager-patch-to-latest.json"},{"path":"oracles/syn-config-mismatch-attention.json","v2Digest":"sha256:747f4d9e6ad5967e66d4fa194063ec430a592886117b16bee687be03692df0a9","v3Digest":"sha256:05a6e142c0297e4be49864d4bef6eaad5d7af7082c006cac7c9f5e6958313116","v3Path":"oracles/syn-v4-config-mismatch-attention.json"},{"path":"oracles/syn-conflicting-argo-cd-versions.json","v2Digest":"sha256:1d8ddabf2a80c54bfff0ec321fe0e49a0d5f43516e05e10aa4d89687b5aabb73","v3Digest":"sha256:26eddee5bcadf1c93827b794f2a7711e595509840bff295bb87ed0bd81d3f66f","v3Path":"oracles/syn-v4-conflicting-argo-cd-versions.json"},{"path":"oracles/syn-exact-context-match-non-authoritative.json","v2Digest":"sha256:9404f912700e47cc161a2d1ce59276e38ef9dce8d87317396cbedfe51e860b50","v3Digest":"sha256:a23512a94097dd09fd77e94e1dbf7a67bb47944877c8c8a62570a8b315e24f84","v3Path":"oracles/syn-v4-exact-context-match-non-authoritative.json"},{"path":"oracles/syn-fleet-equivalence-member-a.json","v2Digest":"sha256:1b29baa564e1b873db86537a16302e7ab30748782686c81156d2f9e90b38e59d","v3Digest":"sha256:df76e6c608d5e327ab3da962f8afaf6abe12722a94898fa84895e5642bb0739c","v3Path":"oracles/syn-v4-fleet-equivalence-member-a.json"},{"path":"oracles/syn-fleet-equivalence-member-b.json","v2Digest":"sha256:c61be7b89a505be33d9ceea4045145fe78a274ee71c5a7d441db4d5447eada6a","v3Digest":"sha256:a08df577c770e5c2f86b8111dc48aba7e53c369cfdb1c568b7d3cc47a51358c8","v3Path":"oracles/syn-v4-fleet-equivalence-member-b.json"},{"path":"oracles/syn-fleet-non-equivalent-config.json","v2Digest":"sha256:3615b5a4581825861afcb17ca1261f69dff19d31976584737c8169011b194205","v3Digest":"sha256:e61d011a906b00a2c11a457af0532847aa79f75f582ce713a6e3a7cabf6644f2","v3Path":"oracles/syn-v4-fleet-non-equivalent-config.json"},{"path":"oracles/syn-managed-gke-like-omissions.json","v2Digest":"sha256:ffd3bc2074a28e5a260fd71112e307bddfc69a6d90590a11f8699d02596c997e","v3Digest":"sha256:d0cf0ac58f95e6e70e89a9a91c2a37a8de90e24b2fa99ac3f6102adff1c3cbc5","v3Path":"oracles/syn-v4-managed-gke-like-omissions.json"},{"path":"oracles/syn-missing-config-unknown.json","v2Digest":"sha256:d9f3376d6f1ba45d7309885ea1bd1b4a943b60ffa1047386d9386356fdae3331","v3Digest":"sha256:134eebda5ed754d8cd4fca209edcf348a14bf5bb64d16bd108175d56965592b5","v3Path":"oracles/syn-v4-missing-config-unknown.json"},{"path":"oracles/syn-no-op-latest-all-components.json","v2Digest":"sha256:704ebcb6d25794e4bcb59d62f094ff3299014962e32aae4437191737d66bb916","v3Digest":"sha256:34c154509d6abc7e826d0c2a0e5b3f07923d4a79a4a07d58f9f41e674426624c","v3Path":"oracles/syn-v4-no-op-latest-all-components.json"},{"path":"oracles/syn-partial-collection-missing-predicates.json","v2Digest":"sha256:8b755ae92285422eed5b47a0461a5908ee7e334a18f7737fc7cf21d77aadf056","v3Digest":"sha256:b02699dc5aab7b29fa60a5f99b70b57b1875d33c7a70b0f73afe543438de4c2b","v3Path":"oracles/syn-v4-partial-collection-missing-predicates.json"},{"path":"oracles/syn-prometheus-minor-to-latest.json","v2Digest":"sha256:def329e1c5918bc14b31145bcdd043a44f62ddee86da38fde3026c3d82362d88","v3Digest":"sha256:cfc79bad951ba664065f2fa06d06d551e3987fd924eb3cd144bed24fc567d9f5","v3Path":"oracles/syn-v4-prometheus-minor-to-latest.json"},{"path":"oracles/syn-stale-observation-negative.json","v2Digest":"sha256:5c08cadfdf81d1a1c71208faacb554be4d304e28c1f12c92d9e8cd4d2270c08d","v3Digest":"sha256:ddfb24a839a5138adfaa4208fe2f7ad64e0b9a41d05d8c66764214c8eff37cd7","v3Path":"oracles/syn-v4-stale-observation-negative.json"},{"path":"oracles/syn-tampered-source-binding-baseline.json","v2Digest":"sha256:043861af80ec116b1b51c6819f3fa98d457343d16f0d9c616ad6eb24184f25c3","v3Digest":"sha256:28d2096bc73ff5b4f68c80ca2367b4814cd3f122d16664d5b030ccfef28b0828","v3Path":"oracles/syn-v4-tampered-source-binding-baseline.json"},{"path":"replay-bridge-gate.json","v2Digest":"sha256:b3e95ab37b446640ed448882b56da02de9b6984b99284243afa47f73deb840e1","v3Digest":"sha256:c073bd7eef29f9e916ff85eb896894b07bfd2547a4f3fad007a991679cb00498","v3Path":"replay-bridge-gate.json"},{"path":"scenarios/syn-argo-cd-minor-to-latest.json","v2Digest":"sha256:50db39658aca79590e44c6b126a1604520489ab00c19721f9aff8484ac6f53af","v3Digest":"sha256:e058584f4ce7075ece02e4a2649056dfa9433c5ec0bb9f0f09d8903a7979d0c1","v3Path":"scenarios/syn-v4-argo-cd-minor-to-latest.json"},{"path":"scenarios/syn-argo-cd-patch-to-latest.json","v2Digest":"sha256:da087094d8da98497345fac1f668daded46d4234a4f82ff6dfa235df4c0b9aa0","v3Digest":"sha256:8385bb16abd85bc3571194c999f2da40610961d966043527294cbeac3d283467","v3Path":"scenarios/syn-v4-argo-cd-patch-to-latest.json"},{"path":"scenarios/syn-argo-workflows-minor-to-latest.json","v2Digest":"sha256:20b79cdafd74f94848ebe5174e1926f683a4e591e843890a19104b7055600b31","v3Digest":"sha256:bdcd4c4dfc27026f8d363203372b090227db71a94acb4d6173e044e865e02c87","v3Path":"scenarios/syn-v4-argo-workflows-minor-to-latest.json"},{"path":"scenarios/syn-cert-manager-minor-to-latest.json","v2Digest":"sha256:ef3b9f923aca48e8570c04a4d5df60bba656c13069e178c04d025f9d77e173d8","v3Digest":"sha256:fa01ad062ddb23a5d125b4f2ba8ee1a669135c746ad3259949643d2c12bd2296","v3Path":"scenarios/syn-v4-cert-manager-minor-to-latest.json"},{"path":"scenarios/syn-cert-manager-patch-to-latest.json","v2Digest":"sha256:80ede9aed37b7ab305dce94e15a4ec45a22dce9b608fa68621707b75bf189e01","v3Digest":"sha256:d1b7c313f9868ca11397a28d5d920525452214358b1fdb7288f2925b671aa1d8","v3Path":"scenarios/syn-v4-cert-manager-patch-to-latest.json"},{"path":"scenarios/syn-config-mismatch-attention.json","v2Digest":"sha256:02882b9720388ce4259878303487ac142a219b53e335898d9e9b5bd8a7a82f1a","v3Digest":"sha256:ca6e9c3b013bb4e4a38dddd2f25d0e19ed6af47f9a3b4afea547a409d48ca31c","v3Path":"scenarios/syn-v4-config-mismatch-attention.json"},{"path":"scenarios/syn-conflicting-argo-cd-versions.json","v2Digest":"sha256:c675388eea87a9840c59d7cd7861fc3d4cebc6b94f0d5fb480928bfc6d2f3456","v3Digest":"sha256:316cfe7c861db04c855e25f83d153a107ab817c09c7e7ae7ec0b24f6f5f2b724","v3Path":"scenarios/syn-v4-conflicting-argo-cd-versions.json"},{"path":"scenarios/syn-exact-context-match-non-authoritative.json","v2Digest":"sha256:bd128d692ebee3025bf0da635c8392ff6231c55003880053b24bc30210906bdf","v3Digest":"sha256:936314e15ef562c194150446f0febbdea9109933c906bae50f63ac3cc855e5e5","v3Path":"scenarios/syn-v4-exact-context-match-non-authoritative.json"},{"path":"scenarios/syn-fleet-equivalence-member-a.json","v2Digest":"sha256:8fbc600ee748999e7ef722b469f99a302378fa54eb1ba6d340ea80ea6400132e","v3Digest":"sha256:4bfa70a7d69433450efb73537c496757995d42ec746577aa4551fc4b3b53b6f8","v3Path":"scenarios/syn-v4-fleet-equivalence-member-a.json"},{"path":"scenarios/syn-fleet-equivalence-member-b.json","v2Digest":"sha256:a0e6c7893ac8f77c916f9140c57e5b7cbfc5c6c52c8fb5041d254b60802b12dc","v3Digest":"sha256:6098cf3bd2a736d51ce719d59f2b397bf56b3863d7e0fdb14744249d402a7a66","v3Path":"scenarios/syn-v4-fleet-equivalence-member-b.json"},{"path":"scenarios/syn-fleet-non-equivalent-config.json","v2Digest":"sha256:3b51d8d76de495d164ef1f6b1aabe2344e445a2009e4dd0a3c357adcb7f0363f","v3Digest":"sha256:c257eaa32b28639270d1cae7b36aaa2fadf1fc8266a734b964da1c1d195424f8","v3Path":"scenarios/syn-v4-fleet-non-equivalent-config.json"},{"path":"scenarios/syn-managed-gke-like